{
  "$schema": "http://json-schema.org/draft-07/schema#",
  "$id": "https://raw.githubusercontent.com/nimbus-agent/nimbus-sdk/main/docs/spec/schemas/v1/nimbus-item.schema.json",
  "title": "NimbusItem",
  "description": "One item the gateway has indexed. Contract version v1.",
  "type": "object",
  "required": ["id", "service", "itemType", "name"],
  "properties": {
    "id": { "type": "string", "pattern": "\\S" },
    "service": { "type": "string", "pattern": "\\S" },
    "itemType": {
      "type": "string",
      "pattern": "\\S",
      "description": "OPEN vocabulary. Deliberately not an enum: src/item-types.ts states that rejecting an item because its type is absent from KNOWN_ITEM_TYPES would break on the next connector. The examples below are hints, never a whitelist.",
      "examples": ["file", "message", "issue", "document", "event"]
    },
    "name": { "type": "string", "pattern": "\\S" },
    "mimeType": { "type": "string" },
    "sizeBytes": { "type": "number" },
    "createdAt": { "type": "number" },
    "modifiedAt": { "type": "number" },
    "url": { "type": "string" },
    "parentId": { "type": "string" },
    "rawMeta": {
      "type": "object",
      "description": "Open by design — Record<string, unknown>. No properties are declared, so the shape guard does not descend into it."
    }
  }
}
