{
  "id": "item-1",
  "service": "example",
  "itemType": "file",
  "name": "notes.md",
  "mimeType": "text/markdown",
  "sizeBytes": 1024,
  "createdAt": 1700000000000,
  "modifiedAt": 1700000100000,
  "url": "https://example.com/items/item-1",
  "parentId": "folder-1",
  "rawMeta": { "revision": 3, "starred": false }
}
